<?xml version="1.0" encoding="UTF-8"?>
<!DOCTYPE jugadores SYSTEM "jugadores.dtd">

<jugadores>

    <jugador id = "j1">
        <nombre> </nombre>
        <apellido> </apellido>
        <edad> </edad> 
        <valorMercado> </valorMercado>
        <juegaSeleccion> </juegaSeleccion>
    </jugador>

    <jugador id = "j2">
        <nombre> </nombre>
        <apellido> </apellido>
        <edad> </edad> 
        <valorMercado> </valorMercado>
        <juegaSeleccion> </juegaSeleccion>
    </jugador>

    <jugador id = "j3">
        <nombre> </nombre>
        <apellido> </apellido>
        <edad> </edad> 
        <valorMercado> </valorMercado>
        <juegaSeleccion> </juegaSeleccion>
    </jugador>

</jugadores>